<?xml version="1.0" encoding="UTF-8"?>
<!DOCTYPE model SYSTEM "TAME.dtd">
<model name="" description="">
<taskTree>
<task number="1" name="Usar Sistema" description="" duration="0" frequency="High" importance="High" interruptability="No interruptible" modality="Manual" occurrence="(0,1)" type="Mental" priority="0">
<preSituation />
<postSituation />
<howToPerform>
<reference name="Method task Usar Sistema" />
<reference name="Method task Usar Sistema 1" />
</howToPerform>
<task number="1.1" name="Efetuar Login" description="" duration="0" frequency="High" importance="High" interruptability="No interruptible" modality="Manual" occurrence="(0,1)" type="Mental" priority="0">
<preSituation />
<postSituation />
<howToPerform>
<reference name="Method task Efetuar Login 1.1" />
</howToPerform>
<action number="1.1.1" name="Inf. Login" description="" duration="0" frequency="High" importance="High" interruptability="No interruptible" modality="Manual" occurrence="(1,1)" type="Mental" priority="0" status="">
<preSituation />
<postSituation />
<actionAgents />
<actionTools />
<actionThings />
</action>
<action number="1.1.2" name="Inf Senha" description="" duration="0" frequency="High" importance="High" interruptability="No interruptible" modality="Manual" occurrence="(1,1)" type="Mental" priority="0" status="">
<preSituation />
<postSituation />
<actionAgents />
<actionTools />
<actionThings />
</action>
<action number="1.1.3" name="Confirmar" description="" duration="0" frequency="High" importance="High" interruptability="No interruptible" modality="Manual" occurrence="(0,1)" type="Mental" priority="0" status="">
<preSituation />
<postSituation />
<actionAgents />
<actionTools />
<actionThings />
</action>
<action number="1.1.4" name="Cancelar" description="" duration="0" frequency="High" importance="High" interruptability="No interruptible" modality="Manual" occurrence="(0,1)" type="Mental" priority="0" status="">
<preSituation />
<postSituation />
<actionAgents />
<actionTools />
<actionThings />
</action>
</task>
<action number="1.2" name="Ger Contas" description="" duration="0" frequency="High" importance="High" interruptability="No interruptible" modality="Manual" occurrence="(0,1)" type="Mental" priority="0" status="">
<preSituation />
<postSituation />
<actionAgents />
<actionTools />
<actionThings />
</action>
<action number="1.3" name="Ger Pacientes" description="" duration="0" frequency="High" importance="High" interruptability="No interruptible" modality="Manual" occurrence="(0,1)" type="Mental" priority="0" status="">
<preSituation />
<postSituation />
<actionAgents />
<actionTools />
<actionThings />
</action>
<action number="1.4" name="Ger Lentes" description="" duration="0" frequency="High" importance="High" interruptability="No interruptible" modality="Manual" occurrence="(0,1)" type="Mental" priority="0" status="">
<preSituation />
<postSituation />
<actionAgents />
<actionTools />
<actionThings />
</action>
<action number="1.5" name="Ger Relatorios" description="" duration="0" frequency="High" importance="High" interruptability="No interruptible" modality="Manual" occurrence="(0,1)" type="Mental" priority="0" status="">
<preSituation />
<postSituation />
<actionAgents />
<actionTools />
<actionThings />
</action>
</task>
</taskTree>
<objects />
<agents />
<tools />
<things />
<situations />
<methods />
</model>

