<?xml version="1.0" encoding="UTF-8"?>
<!DOCTYPE model SYSTEM "TAME.dtd">
<model name="" description="">
<taskTree>
<task number="1" name="Ger Fornecedor" description="" duration="0" frequency="High" importance="High" interruptability="No interruptible" modality="Manual" occurrence="(0,1)" type="Mental" priority="0">
<preSituation />
<postSituation />
<howToPerform>
<reference name="Method task Ger Fornecedor 1" />
</howToPerform>
<task number="1.1" name="Ad. Fornec" description="" duration="0" frequency="High" importance="High" interruptability="No interruptible" modality="Manual" occurrence="(0,1)" type="Mental" priority="0">
<preSituation />
<postSituation />
<howToPerform>
<reference name="Method task Ad. Fornec 1.1" />
</howToPerform>
<action number="1.1.1" name="Inf Nome" description="" duration="0" frequency="High" importance="High" interruptability="No interruptible" modality="Manual" occurrence="(0,1)" type="Mental" priority="0" status="">
<preSituation />
<postSituation />
<actionAgents />
<actionTools />
<actionThings />
</action>
<action number="1.1.2" name="Inf Lentes" description="" duration="0" frequency="High" importance="High" interruptability="No interruptible" modality="Manual" occurrence="(0,1)" type="Mental" priority="0" status="">
<preSituation />
<postSituation />
<actionAgents />
<actionTools />
<actionThings />
</action>
<action number="1.1.3" name="Inf CNPJ" description="" duration="0" frequency="High" importance="High" interruptability="No interruptible" modality="Manual" occurrence="(0,1)" type="Mental" priority="0" status="">
<preSituation />
<postSituation />
<actionAgents />
<actionTools />
<actionThings />
</action>
<action number="1.1.4" name="Inf Telefone" description="" duration="0" frequency="High" importance="High" interruptability="No interruptible" modality="Manual" occurrence="(0,1)" type="Mental" priority="0" status="">
<preSituation />
<postSituation />
<actionAgents />
<actionTools />
<actionThings />
</action>
<action number="1.1.5" name="Inf email" description="" duration="0" frequency="High" importance="High" interruptability="No interruptible" modality="Manual" occurrence="(0,1)" type="Mental" priority="0" status="">
<preSituation />
<postSituation />
<actionAgents />
<actionTools />
<actionThings />
</action>
<action number="1.1.6" name="Ger Codigo" description="" duration="0" frequency="High" importance="High" interruptability="No interruptible" modality="Manual" occurrence="(0,1)" type="Mental" priority="0" status="">
<preSituation />
<postSituation />
<actionAgents />
<actionTools />
<actionThings />
</action>
</task>
<task number="1.2" name="Pesq Fornec" description="" duration="0" frequency="High" importance="High" interruptability="No interruptible" modality="Manual" occurrence="(0,1)" type="Mental" priority="0">
<preSituation />
<postSituation />
<howToPerform>
<reference name="Method task Pesq Fornec 1.2" />
</howToPerform>
<action number="1.2.1" name="Inf Nome" description="" duration="0" frequency="High" importance="High" interruptability="No interruptible" modality="Manual" occurrence="(0,1)" type="Mental" priority="0" status="">
<preSituation />
<postSituation />
<actionAgents />
<actionTools />
<actionThings />
</action>
<action number="1.2.2" name="Inf Lente" description="" duration="0" frequency="High" importance="High" interruptability="No interruptible" modality="Manual" occurrence="(0,1)" type="Mental" priority="0" status="">
<preSituation />
<postSituation />
<actionAgents />
<actionTools />
<actionThings />
</action>
</task>
<task number="1.3" name="Remover Fornec" description="" duration="0" frequency="High" importance="High" interruptability="No interruptible" modality="Manual" occurrence="(0,1)" type="Mental" priority="0">
<preSituation />
<postSituation />
<howToPerform>
<reference name="Method task Remover Fornec 1.3" />
</howToPerform>
<action number="1.3.1" name="Inf Nome" description="" duration="0" frequency="High" importance="High" interruptability="No interruptible" modality="Manual" occurrence="(0,1)" type="Mental" priority="0" status="">
<preSituation />
<postSituation />
<actionAgents />
<actionTools />
<actionThings />
</action>
<action number="1.3.2" name="Inf Codigo" description="" duration="0" frequency="High" importance="High" interruptability="No interruptible" modality="Manual" occurrence="(0,1)" type="Mental" priority="0" status="">
<preSituation />
<postSituation />
<actionAgents />
<actionTools />
<actionThings />
</action>
</task>
<task number="1.4" name="Modif Fornec" description="" duration="0" frequency="High" importance="High" interruptability="No interruptible" modality="Manual" occurrence="(0,1)" type="Mental" priority="0">
<preSituation />
<postSituation />
<howToPerform>
<reference name="Method task Modif Fornec 1.4" />
</howToPerform>
<action number="1.4.1" name="Inf Dado Antigo" description="" duration="0" frequency="High" importance="High" interruptability="No interruptible" modality="Manual" occurrence="(0,1)" type="Mental" priority="0" status="">
<preSituation />
<postSituation />
<actionAgents />
<actionTools />
<actionThings />
</action>
<action number="1.4.2" name="Inf Dado Novo" description="" duration="0" frequency="High" importance="High" interruptability="No interruptible" modality="Manual" occurrence="(0,1)" type="Mental" priority="0" status="">
<preSituation />
<postSituation />
<actionAgents />
<actionTools />
<actionThings />
</action>
</task>
</task>
</taskTree>
<objects />
<agents />
<tools />
<things />
<situations />
<methods>
<method name="Method task Ger Fornecedor 1" description="" instant="0" body="SEQ(Ad. Fornec, Pesq Fornec, Remover Fornec, Modif Fornec)" />
<method name="Method task Ad. Fornec 1.1" description="" instant="0" body="SEQ(AND(Inf Nome, Inf Lentes,Inf CNPJ,Inf Telefone,Inf email), Ger Codigo)" />
<method name="Method task Pesq Fornec 1.2" description="" instant="0" body="SEQ(Inf Nome, Inf Lente)" />
<method name="Method task Remover Fornec 1.3" description="" instant="0" body="SEQ(Inf Nome, Inf Codigo)" />
<method name="Method task Modif Fornec 1.4" description="" instant="0" body="SEQ()" />
</methods>
</model>

