<?xml version="1.0" encoding="UTF-8"?>
<!DOCTYPE model SYSTEM "TAME.dtd">
<model name="" description="">
<taskTree>
<task number="1" name="Gerenciar Consulta" description="" duration="0" frequency="High" importance="High" interruptability="No interruptible" modality="Manual" occurrence="(0,1)" type="Mental" priority="0">
<preSituation />
<postSituation />
<howToPerform>
<reference name="Method task Gerenciar Consulta" />
<reference name="Method task Gerenciar Consulta 1" />
</howToPerform>
<task number="1.1" name="Marcar Consulta" description="" duration="0" frequency="High" importance="High" interruptability="No interruptible" modality="Manual" occurrence="(0,1)" type="Mental" priority="0">
<preSituation />
<postSituation />
<howToPerform>
<reference name="Method task Marcar Consulta 1.1" />
</howToPerform>
<action number="1.1.1" name="Inf Paciente" description="" duration="0" frequency="High" importance="High" interruptability="No interruptible" modality="Manual" occurrence="(1,1)" type="Mental" priority="0" status="">
<preSituation />
<postSituation />
<actionAgents />
<actionTools />
<actionThings />
</action>
<action number="1.1.2" name="Inf Medico" description="" duration="0" frequency="High" importance="High" interruptability="No interruptible" modality="Manual" occurrence="(1,1)" type="Mental" priority="0" status="">
<preSituation />
<postSituation />
<actionAgents />
<actionTools />
<actionThings />
</action>
<action number="1.1.3" name="Inf Horario" description="" duration="0" frequency="High" importance="High" interruptability="No interruptible" modality="Manual" occurrence="(1,1)" type="Mental" priority="0" status="">
<preSituation />
<postSituation />
<actionAgents />
<actionTools />
<actionThings />
</action>
</task>
<task number="1.2" name="Remover Consulta" description="" duration="0" frequency="High" importance="High" interruptability="No interruptible" modality="Manual" occurrence="(0,1)" type="Mental" priority="0">
<preSituation />
<postSituation />
<howToPerform>
<reference name="Method task Remover Consulta 1.2" />
</howToPerform>
<action number="1.2.1" name="Inf Paciente" description="" duration="0" frequency="High" importance="High" interruptability="No interruptible" modality="Manual" occurrence="(1,1)" type="Mental" priority="0" status="">
<preSituation />
<postSituation />
<actionAgents />
<actionTools />
<actionThings />
</action>
<action number="1.2.2" name="Inf Medico" description="" duration="0" frequency="High" importance="High" interruptability="No interruptible" modality="Manual" occurrence="(1,1)" type="Mental" priority="0" status="">
<preSituation />
<postSituation />
<actionAgents />
<actionTools />
<actionThings />
</action>
<action number="1.2.3" name="Inf Horario" description="" duration="0" frequency="High" importance="High" interruptability="No interruptible" modality="Manual" occurrence="(1,1)" type="Mental" priority="0" status="">
<preSituation />
<postSituation />
<actionAgents />
<actionTools />
<actionThings />
</action>
</task>
<task number="1.3" name="Localizar Consulta" description="" duration="0" frequency="High" importance="High" interruptability="No interruptible" modality="Manual" occurrence="(0,1)" type="Mental" priority="0">
<preSituation />
<postSituation />
<howToPerform>
<reference name="Method task Localizar Consulta 1.3" />
</howToPerform>
<action number="1.3.1" name="Inf Médico" description="" duration="0" frequency="High" importance="High" interruptability="No interruptible" modality="Manual" occurrence="(0,1)" type="Mental" priority="0" status="">
<preSituation />
<postSituation />
<actionAgents />
<actionTools />
<actionThings />
</action>
<action number="1.3.2" name="Inf Paciente" description="" duration="0" frequency="High" importance="High" interruptability="No interruptible" modality="Manual" occurrence="(0,1)" type="Mental" priority="0" status="">
<preSituation />
<postSituation />
<actionAgents />
<actionTools />
<actionThings />
</action>
<action number="1.3.3" name="Inf Data" description="" duration="0" frequency="High" importance="High" interruptability="No interruptible" modality="Manual" occurrence="(0,1)" type="Mental" priority="0" status="">
<preSituation />
<postSituation />
<actionAgents />
<actionTools />
<actionThings />
</action>
</task>
</task>
</taskTree>
<objects />
<agents />
<tools />
<things />
<situations />
<methods>
<method name="Method task Gerenciar Consulta" description="" instant="0" body="SEQ(Inf Paciente, Inf Medico, Inf Horario, XOR(Confirmar, Cancelar))" />
<method name="Method task Gerenciar Consulta 1" description="" instant="0" body="SEQ(Marcar Consulta, Remover Consulta, Localizar Consulta)" />
<method name="Method task Marcar Consulta 1.1" description="" instant="0" body="SEQ(Inf Paciente, Inf Medico, Inf Horario)" />
<method name="Method task Remover Consulta 1.2" description="" instant="0" body="SEQ(Inf Paciente, Inf Medico, Inf Horario)" />
<method name="Method task Localizar Consulta 1.3" description="" instant="0" body="SEQ(Inf Médico, Inf Paciente, Inf Data)" />
</methods>
</model>

